<?xml version="1.0" encoding="UTF-8"?>
<?xml-stylesheet href="doc.xsl" type="text/xsl"?>
<doclist xmlns:xsi="http://www.w3.org/2001/XMLSchema-instance" xsi:noNamespaceSchemaLocation="./doctor.xsd">
    <doc>
        <id>1</id>
        <name>dlhfkdhf</name>
        <spec>bone</spec>
        <qual>MBBS MDS</qual>
    </doc>
    <doc>
        <id>2</id>
        <name>dfdfg</name>
        <spec>heart</spec>
        <qual>MBBS MDS</qual>
    </doc>
    <doc>
        <id>3</id>
        <name>fdggdfg</name>
        <spec>skin</spec>
        <qual>MBBS MDS</qual>
    </doc>
    <doc>
        <id>4</id>
        <name>dgsf</name>
        <spec>bone</spec>
        <qual>MBBS MDS</qual>
    </doc>
    <doc>
        <id>5</id>
        <name>dlhfkdhf</name>
        <spec>ENT</spec>
        <qual>MBBS MDS</qual>
    </doc>
</doclist>